{
  "schemaVersion": "1.0.0",
  "frameworkId": "ncom",
  "fromCollectionId": "docs-20260730080005972-a7f74ece",
  "toCollectionId": "docs-20260730080339265-a7f74ece",
  "added": [],
  "removed": [],
  "modified": [],
  "rootHash": "sha256:2e9ae1fadfcf00ed239b78527a8ec6df5d192dfc082d8a64e9c0739155ab7e55"
}
